{"backend":"native-mna","implementationVersion":"2.4.0","protocolVersion":1,"provenance":{"backend":"native-mna","circuitIRVersion":1,"implementationVersion":"2.4.0","modelSource":"embedded-circuit-ir","productVersion":"2.4.0","protocolMediaType":"application/vnd.ohmlab.simulation+json;version=1","requestSHA256":"10de8f1ba9b78ac7e6096c81a7110dc153bc609657517439d1bca8b2f0ca4910","simulationResultVersion":1},"requestID":"golden-native-divider","result":{"contractVersion":1,"dc":{"components":[{"current":-0.0025,"name":"V1","voltage":5},{"current":0.0024999999999999996,"name":"R1","voltage":2.4999999999999996},{"current":0.0025000000000000005,"name":"R2","voltage":2.5000000000000004}],"converged":true,"nodes":[{"name":"in","value":5},{"name":"out","value":2.5000000000000004}],"sources":[{"name":"V1","value":-0.0025}]},"fourier":[],"warnings":[]},"status":"success"}
